authors,title,description,copies,publisher,pages,isbn10,kind,image,durataprestito,condizioniestensione
Paul Tremblay,The Cabin at the End of the World,"NATIONAL BESTSELLER! BEST BOOK OF 2018 (Library Journal, NPR, Buzzfeed) LOCUS RECOMMENDED READING LIST - 2018 JULY 2018 INDIE NEXT PICK! SUMMER 2018 PUBLISHERS WEEKLY PICK! “A tremendous book―thought-provoking and terrifying, with tension that winds up like a chain. The Cabin at the End of the World is Tremblay’s personal best. It’s that good.” — Stephen King “A clinic in suspense, a story that opens with high-wire tension and never lets up from there.” — Michael Koryta ""I tore through it in record time. I just couldn’t wait to see where Tremblay was going to take me next.” — Victor LaValle The Bram Stoker Award-winning author of A Head Full of Ghosts adds an inventive twist to the home invasion horror story in a heart-palpitating novel of psychological suspense that recalls Stephen King’s Misery, Ruth Ware’s In a Dark, Dark Wood, and Jack Ketchum’s cult hit The Girl Next Door. Seven-year-old Wen and her parents, Eric and Andrew, are vacationing at a remote cabin on a quiet New Hampshire lake. Their closest neighbors are more than two miles in either direction along a rutted dirt road. One afternoon, as Wen catches grasshoppers in the front yard, a stranger unexpectedly appears in the driveway. Leonard is the largest man Wen has ever seen but he is young, friendly, and he wins her over almost instantly. Leonard and Wen talk and play until Leonard abruptly apologizes and tells Wen, ""None of what’s going to happen is your fault"". Three more strangers then arrive at the cabin carrying unidentifiable, menacing objects. As Wen sprints inside to warn her parents, Leonard calls out: ""Your dads won’t want to let us in, Wen. But they have to. We need your help to save the world."" Thus begins an unbearably tense, gripping tale of paranoia, sacrifice, apocalypse, and survival that escalates to a shattering conclusion, one in which the fate of a loving family and quite possibly all of humanity are entwined. The Cabin at the End of the World is a masterpiece of terror and suspense from the fantastically fertile imagination of Paul Tremblay. “Read Paul Tremblay's new novel, The Cabin at the End of the World, and you might not sleep for a week. Longer. It will shape your nightmares for months – that's pretty much guaranteed.” — NPR “Gripping, horrifying, and mesmerizing.” — GQ “A tour-de-force of psychological and religious horror.” — BN.com “A blinding tale of survival and sacrifice.” — Kirkus Reviews “Tremblay has a real winner here.” — Tor.com",5,HarperCollins,288,62679120,horror,/copertina libri/TheCabinAtTheEndOfTheWorld.jpg,30,È possibile estendere il prestito per altri 30 giorni.
Mary SanGiovanni,Chills (versione italiana),"True Detective incontra H.P. Lovecraft in questo romanzo dell’acclamata autrice Mary Sangiovanni. Tutto comincia con una brutale nevicata a maggio. L’area più colpita è la cittadina rurale di Colby, nel Connecticut. Le scuole e le attività sono chiuse, la rete elettrica è fuori uso, e il detective Jack Glazier trova un cadavere nella neve. Sembra essere la vittima di un bizzarro omicidio rituale. Non sarà l’ultima. Mentre la neve si accumula, così si accumulano i sacrifici. Tagliato fuori dal resto del mondo, Glazier si allea con una specialista dell’occulto per scovare la società segreta che si nasconde tra loro. Gli dei che adorano sono inimmaginabili. I poteri che evocano sono inarrestabili. E le cose che faranno alla brava gente di Colby sono profondamente, orribilmente innominabili… Dicono di Chills: «L’atmosfera è perfetta, i mostri debitamente grotteschi e la minaccia sovrannaturale legittimamente spaventosa.» (BEAUTY IN RUINS) «Mary Sangiovanni di certo sa come scrivere di mostri.» (POSTCARDS FROM A DYING WORLD) «In Chills, Mary Sangiovanni fa un lavoro eccezionale nel riuscire a catturare la minaccia, il pericolo e persino l’orrore del freddo estremo.» (SKULLS IN THE STARS) L’AUTRICE: Mary Sangiovanni è l’autrice della trilogia The Hollower (il cui primo volume è stato nominato per il Bram Stoker Award), e dei romanzi Thrall, Chaos, Chills e l’imminente Savage Woods. Nell’ultimo decennio i suoi racconti sono apparsi in periodici e antologie. Ha un master in Writing Popular Fiction della Seton Hill University di Pittsburgh ed è al momento membro della Authors Guild, della International Thriller Writers e della Penn Writers ed è stata in precedenza membro attivo della Horror Writers Association.",5,Dunwich Edizioni,236,8899635692,horror,/copertina libri/Chills.jpg,30,È possibile estendere il prestito per altri 30 giorni.
Paul Wells,The Horror Genre,"A comprehensive introduction to the history and key themes of the genre. The main issues and debates raised by horror, and the approaches and theories that have been applied to horror texts are all featured. In addressing the evolution of the horror film in social and historical context, Paul Wells explores how it has reflected and commented upon particular historical periods, and asks how it may respond to the new millennium by citing recent innovations in the genre's development, such as the ""urban myth"" narrative underpinning Candyman and The Blair Witch Project. Over 300 films are treated, all of which are featured in the filmography.",5,Wallflower Press,130,1903364000,horror,/copertina libri/TheHorrorGenre.jpg,30,È possibile estendere il prestito per altri 30 giorni.
"Mark Twain,Robert Blaisdell,John Green",Tom Sawyer,The adventures of a mischievous young boy and his friends growing up in a Mississippi River town in the nineteenth century.,5,Courier Corporation,92,4862915616,avventura,/copertina libri/TomSawyer.jpg,30,È possibile estendere il prestito per altri 30 giorni.
Herman Melville,The Moby-Dick - Or Whale,"Many of the earliest books, particularly those dating back to the 1900s and before, are now extremely scarce and increasingly expensive. We are republishing these classic works in affordable, high quality, modern editions, using the original text and artwork.",5,Read Books Ltd,883,1473374588,avventura,/copertina libri/MobyDick.jpg,30,È possibile estendere il prestito per altri 30 giorni.
Joseph Conrad,Cuore di tenebra,"L'incontro con la tremenda realtà dello schiavismo nell'Africa centrale, la rivelazione dei guasti della solitudine, un confronto inquietante col diverso e col primitivo. Il capolavoro del grande narratore inglese d'origine polacca Joseph Conrad (1857-192",5,Edizioni Mondadori,336,8852010866,avventura,/copertina libri/CuoreDiTenebra.jpg,30,È possibile estendere il prestito per altri 30 giorni.
Jules Verne,Ventimila leghe sotto i mari,"Un oggetto misterioso, più grande e più rapido di una balena, solca gli oceani a fine Ottocento. Tutti si interrogano su questa apparizione incredibile. Se ne parla dovunque: nei caffè, nei teatri e sulle pagine dei giornali. Poi l’oggetto misterioso comincia ad affondare alcune navi, e la paura si sovrappone alla curiosità. Di cosa si tratta? Lo scoprirà un gruppo di naufraghi, e sarà una scoperta straordinaria. Non è un pesce mostruoso, né un gigantesco cetaceo a spargere il terrore nei mari. È un sommergibile, il Nautilus, guidato dall’indimenticabile figura del capitano Nemo, un uomo solitario in lotta con il mondo. Ma saliti a bordo del Nautilus le avventure sono appena cominciate: in compagnia del capitano Nemo si attraverseranno le profondità degli oceani, si visiteranno città sommerse, si combatterà contro polpi giganteschi. Un susseguirsi di vicende appassionanti che hanno fatto di questo romanzo uno dei capolavori immortali nati dalla fantasia di Verne.Jules Verne(Nantes 1828-Amiens 1905) fu autore di circa sessanta romanzi di viaggi e avventura, spesso ispirati ai processi tecnologici. Tra i più noti: Cinque settimane in pallone (1863), Viaggio al centro della Terra (1864), Dalla Terra alla Luna (1865), I figli del capitano Grant (1867), Il giro del mondo in 80 giorni (1873), L’isola misteriosa (1874) e Michele Strogoff (1876). Di Jules Verne la Newton Compton ha pubblicato Viaggio al centro della Terra, Il giro del mondo in 80 giorni e Ventimila leghe sotto i mari.",5,Newton Compton Editori,419,8854130508,avventura,/copertina libri/VentimilaLegheSottoIMari.jpg,30,È possibile estendere il prestito per altri 30 giorni.
Daniel Defoe,Robinson Crusoe,"Robinson Crusoe is one of the most famous literary characters in history, and his story has spawned hundreds of retellings. Inspired by the life of Alexander Selkirk, a sailor who lived for several years on a Pacific island, the novel tells the story of Crusoe’s survival after shipwreck on an island, interaction with the mainland’s native inhabitants, and eventual rescue. Read variously as economic fable, religious allegory, or imperialist fantasy, Crusoe has never lost its appeal as one of the most compelling adventure stories of all time. In addition to an introduction and helpful notes, this Broadview Edition includes a wide range of appendices that situate Defoe’s 1719 novel amidst castaway narratives, economic treatises, reports of cannibalism, explorations of solitude, and Defoe’s own writings on slavery and the African trade. A final appendix presents images of Crusoe’s rescue of Friday from a dozen of the most significant illustrated editions of the novel published between 1719 and 1920.",5,Broadview Press,422,1770482245,avventura,/copertina libri/RobinsonCrusoe.jpg,30,È possibile estendere il prestito per altri 30 giorni.
Jon Krakauer,Nelle terre estreme,"IL LIBRO CULT DA CUI È STATO TRATTO INTO THE WILD. Nell’aprile del 1992 Chris McCandless si incamminò da solo negli immensi spazi selvaggi dell’Alaska. Due anni prima, terminati gli studi, aveva abbandonato tutti i suoi averi e donato i suoi risparmi in beneficenza: voleva lasciare la civiltà per immergersi nella natura. Non adeguatamente equipaggiato, senza alcuna preparazione alle condizioni estreme che avrebbe incontrato, venne ritrovato morto da un cacciatore, quattro mesi dopo la sua partenza per le terre a nord del Monte McKinley. Accanto al cadavere fu rinvenuto un diario che Chris aveva inaugurato al suo arrivo in Alaska e che ha permesso di ricostruire le sue ultime settimane. Jon Krakauer si imbatté quasi per caso in questa vicenda, rimanendone quasi ossessionato, e scrisse un lungo articolo sulla rivista «Outside» che suscitò enorme interesse. In seguito, con l’aiuto della famiglia di Chris, si è dedicato alla ricostruzione del lungo viaggio del ragazzo: due anni attraverso l’America all’inseguimento di un sogno. Questo libro, in cui Krakauer cerca di capire cosa può aver spinto Chris a ricercare uno stato di purezza assoluta a contatto con una natura incontaminata, è il risultato di tre anni di ricerche. Ma «Nelle terre estreme», però, non è solo la ricostruzione degli eventi che portarono Chris McCandless alla morte, è anche una metafora sul rapporto tra la nostra civiltà e la natura che la circonda, è un formidabile tentativo di penetrare le segrete vibrazioni che percorrono tutte le giovinezze, è un viaggio del corpo e dell’anima scritto da un maestro del racconto d’avventura che qui si mette in gioco lasciandosi coinvolgere – assieme al lettore – dalle figure eroiche di cui narra.",5,Corbaccio,274,8863800936,avventura,/copertina libri/NelleTerreEstreme.jpg,30,È possibile estendere il prestito per altri 30 giorni.
Jon Krakauer,Into the Wild,"In April 1992 a young man from a well-to-do family hitchhiked to Alaska and walked alone into the wilderness north of Mt. McKinley. His name was Christopher Johnson McCandless. He had given $25,000 in savings to charity, abandoned his car and most of his possessions, burned all the cash in his wallet, and invented a new life for himself. Four months later, his decomposed body was found by a moose hunter. How McCandless came to die is the unforgettable story of Into the Wild. Immediately after graduating from college in 1991, McCandless had roamed through the West and Southwest on a vision quest like those made by his heroes Jack London and John Muir. In the Mojave Desert he abandoned his car, stripped it of its license plates, and burned all of his cash. He would give himself a new name, Alexander Supertramp, and , unencumbered by money and belongings, he would be free to wallow in the raw, unfiltered experiences that nature presented. Craving a blank spot on the map, McCandless simply threw the maps away. Leaving behind his desperate parents and sister, he vanished into the wild. Jon Krakauer constructs a clarifying prism through which he reassembles the disquieting facts of McCandless's short life. Admitting an interst that borders on obsession, he searches for the clues to the dries and desires that propelled McCandless. Digging deeply, he takes an inherently compelling mystery and unravels the larger riddles it holds: the profound pull of the American wilderness on our imagination; the allure of high-risk activities to young men of a certain cast of mind; the complex, charged bond between fathers and sons. When McCandless's innocent mistakes turn out to be irreversible and fatal, he becomes the stuff of tabloid headlines and is dismissed for his naiveté, pretensions, and hubris. He is said to have had a death wish but wanting to die is a very different thing from being compelled to look over the edge. Krakauer brings McCandless's uncompromising pilgrimage out of the shadows, and the peril, adversity , and renunciation sought by this enigmatic young man are illuminated with a rare understanding--and not an ounce of sentimentality. Mesmerizing, heartbreaking, Into the Wild is a tour de force. The power and luminosity of Jon Krakauer's stoytelling blaze through every page. From the Trade Paperback edition.",5,Anchor,240,3074768637,avventura,/copertina libri/IntoTheWild.jpg,30,È possibile estendere il prestito per altri 30 giorni.
Anna Banti,Zanna Bianca,"Zanna Bianca, il protagonista del romanzo, è l’unico di quattro cuccioli che riesce a sopravvivere in una grotta dello Yukon, sopra un torrente, lontano da ovunque. Dentro la tana inaccessibile, il piccolo lupo viene al mondo generato da colei che viene semplicemente presentata come ‘la lupa’ e la prima parte del libro lascia in questa sospensione il lettore per condurlo sulla pista dei valori ‘primordiali’, senza nomi e cognomi. È come se London volesse sfruttare un archetipo e i suoi simboli; solo in seguito scopriamo che ‘la lupa’ è Kiche, figlia di un lupo e di un cane, una femmina agguerrita e astuta, già di proprietà del capotribù Castoro Grigio. […] Zanna Bianca nasce nel Wild e nasce lupo con dentro il codice genetico del cane: quest’altro archetipo alla fine prevarrà dopo una lunga storia formativa fatta di durezza e amore, rinuncia e crudeltà. Anche il padre di Zanna Bianca è un archetipo, ma il vecchio lupo grigio Occhio Solo, sopravvissuto a mille battaglie e alla furia della natura selvaggia, diventa il simbolo della vita che sopravvive a se stessa, del Wild che scorre dalle generazioni che lo hanno preceduto a quelle future.",5,Giunti Junior,150,8809754042,avventura,/copertina libri/ZannaBianca.jpg,30,È possibile estendere il prestito per altri 30 giorni.
Mark Twain,Le avventure di Huckleberry Finn,"“La storia di Huck e della sua fuga in zattera lungo il Mississippi con il negro Jim, fino al ricongiungimento col compagno di scorrerie Tom Sawyer negli ultimi capitoli di un libro che nacque come proseguimento del precedente Le avventure di Tom Sawyer era tra le preferite di Ernest Hemingway, che citava sempre Mark Twain tra i suoi autori fondamentali: e non a caso, naturalmente, visto che fin dai suoi esordi anche l’autore di Fiesta lavorò molto duramente per riuscire a ricreare sulla pagina la lingua della strada, cosa per cui venne assai criticato. Molti, tra cui Joyce Carol Oates, considerano Le avventure di Huckleberry Finn “Il Grande Romanzo Americano”. Altri, come Thomas Stearns Eliot, lo considerano l’unico vero capolavoro di Mark Twain. Di sicuro Le avventure di Huckleberry Finn è un romanzo-mondo, scritto superbamente, e divertentissimo. Huck Finn, in quanto ribelle adolescente refrattario a qualsiasi forma di autorità e di imposizione, sta all’origine di Holden Caulfield e di tutti i ribelli adolescenti della letteratura nordamericana. E il fiume Mississippi, che Twain conobbe a fondo in gioventù per averci lavorato come pilota su un battello, è al tempo stesso uno dei protagonisti principali del libro e una metafora. Ma la storia di Huck Finn e del suo lungo viaggio, al termine del quale l’ormai ex ragazzino verrà a sapere della morte del padre e però subito progetterà di ripartire con i suoi compagni d’avventura (questa volta per i Territori Indiani) è anche una grande satira sulla democrazia americana e sugli americani, in genere timorati di Dio ma sempre felici di impiccare un negro (e quando si parla di leggi razziali bisognerebbe ricordarsi ogni volta di aggiungere che gli Stati Uniti d’America hanno mantenuto le loro fino alla seconda metà del Novecento).”(dall’Introduzione di Giuseppe Culicchia)",5,Feltrinelli Editore,284,8807943980,avventura,/copertina libri/HuckFinn.jpg,30,È possibile estendere il prestito per altri 30 giorni.
Jules Verne,Viaggio al centro della Terra,"Viaggio al centro della Terra (titolo originale Voyage au centre de la Terre) è un romanzo fantastico di Jules Verne, pubblicato nel 1864. È uno dei primi romanzi della serie “Viaggi straordinari attraverso i mondi conosciuti e sconosciuti” (oltre sessanta volumi scritti fra il 1862 e il 1905).",5,Giunti Editore,250,8809753844,avventura,/copertina libri/ViaggioAlCentroDellaTerra.jpg,30,È possibile estendere il prestito per altri 30 giorni.
Miguel de Cervantes Saavedra,Don Chisciotte della Mancia,"Il viaggio descritto dal romanzo di Verne è chiaramente un viaggio impossibile, eppure l’autore, considerato uno dei grandi padri della fantascienza, riesce a renderlo quasi credibile e sicuramente appassionante.",5,E-text,432,8897313116,avventura,/copertina libri/DonChisciotte.jpg,30,È possibile estendere il prestito per altri 30 giorni.
Jules Verne,Il giro del mondo in 80 giorni,"Nel lontano 2 ottobre 1872 il londinese Fogg e il francese Passepartout iniziano un viaggio di 80 giorni attorno al mondo per vincere una scommessa di ventimila sterline stipulata con i compagni del Club della Riforma. Passando da Bombay a Hong Kong, da Shangai a San Francisco, Fogg e Passepartout entreranno in contatto con culture e usanze sconosciute, e dovranno affrontare numerosi imprevisti e avversità che ostacoleranno il compimento dell'impresa: a partire dal servitore che si ubriaca e perde i biglietti, per finire con un agente che sorveglia la spedizione convinto di aver riconosciuto in Fogg un famoso ladro, autore di una rapina alla banca d'Inghilterra. Per vincere la scommessa Fogg dovrà infine affittare un battello a vapore con cui attraversare l'Oceano Atlantico. Nonostante il ritardo accumulato la scommessa verrà vinta, non senza un ultimo colpo di scena. Introduzione di Beatrice Masini.",5,Fanucci Editore,225,8834724852,avventura,/copertina libri/IlGiroDelMondoIn80Giorni.jpg,30,È possibile estendere il prestito per altri 30 giorni.
Carlo Collodi,Le Aventure di Pinocchio,"PRAISE FOR THE FIRST EDITION: ""The best English translation.""--Franco Fido, Harvard University ""A literary masterpiece. Perella's translation is excellent and is unlikely to be surpassed.""--Ernesto G. Caserta, Duke University ""The real Pinocchio offers pleasures never hinted at by Disney.... A masterful blend of realism and fantasy.""--Voice Literary Supplement ""Perella's opening essay is no mere 'introduction'; it is the fullest exposition of the novel ever to appear in English.... Enormously rewarding.""--The Pinocchio Catalogue",5,Univ of California Press,498,520246861,avventura,/copertina libri/Pinocchio.jpg,30,È possibile estendere il prestito per altri 30 giorni.
Jonathan Swift,I viaggi di Gulliver,"I viaggi di Gulliver (Gulliver’s Travels) è il capolavoro dello scrittore irlandese Jonathan Swift (1667-1745), uno dei massimi autori satirici in lingua inglese. Il libro, pubblicato inizialmente anonimo nel 1726 1, racconta le disavventure per mare di un medico di bordo, Lemuel Gulliver, che incontra esseri e popolazioni fantastiche su isole immaginarie. ",5,Feltrinelli,392,8807821397,avventura,/copertina libri/IViaggiDiGulliver.jpg,30,È possibile estendere il prestito per altri 30 giorni.
Michael Crichton,Jurassic Park,"From the author of Timeline, Sphere, and Congo, this is the classic thriller of science run amok that took the world by storm. #1 NEW YORK TIMES BESTSELLER “Wonderful . . . powerful.”—The Washington Post Book World An astonishing technique for recovering and cloning dinosaur DNA has been discovered. Now humankind’s most thrilling fantasies have come true. Creatures extinct for eons roam Jurassic Park with their awesome presence and profound mystery, and all the world can visit them—for a price. Until something goes wrong. . . . In Jurassic Park, Michael Crichton taps all his mesmerizing talent and scientific brilliance to create his most electrifying technothriller. “Frighteningly real . . . compelling . . . It’ll keep you riveted.”—The Detroit News “Crichton’s dinosaurs are genuinely frightening.”—Chicago Sun-Times “Full of suspense.”—The New York Times Book Review",5,Ballantine Books,416,307763056,avventura,/copertina libri/JurassicPark.jpg,30,È possibile estendere il prestito per altri 30 giorni.
Henry Rider Haggard,THE WANDERER'S NECKLACE (Medieval Adventure Novel),"Olaf, a Norseman in the eighth century A.D., flees his homeland after challenging the Norse god Odin's right to a human sacrifice, travels to Constantinople (Istanbul, Turkey) to protect the Empress Irene Augusta from her son Constantine the Fifth and other enemies of the Eastern Roman Empire. From Byzantinum, to the pyramid tombs of Upper Egypt, Olaf becomes a traveling Christian who must reject the adulterous advances of Irene. Blinded as punishment for rejecting the Empress, Olaf's adventures are woven within the intrigues of the Eastern Roman Empire. Sir Henry Rider Haggard (1856-1925) was an English writer of adventure novels and dark fantasy stories set in exotic locations, predominantly Africa, and a pioneer of the Lost World literary genre.",5,Musaicum Books,224,8075834356,avventura,/copertina libri/WanderersNecklace.jpg,30,È possibile estendere il prestito per altri 30 giorni.
"Clive Cussler,Craig Dirgo",Golden Buddha,"Captain Cabrillo and his intelligence agents plan to strike a deal with the Russians and Chinese to exchange a golden Buddha containing records of oil reserves for Tibet's freedom, but his enemies will do anything to stop him.",5,Penguin,420,425191729,avventura,/copertina libri/GoldenBuddha.jpg,30,È possibile estendere il prestito per altri 30 giorni.
Jack London,Il richiamo della foresta,"Un romanzo potente e affascinante, che il poeta Carl Sandburg ha definito ""la più grande storia di cani mai scritta, e allo stesso tempo lo studio di uno dei moventi più curiosi e profondi che giochino a rimpiattino dentro l'anima umana"".",5,Edizioni Mondadori,144,8852022007,avventura,/copertina libri/IlRichiamoDellaForesta.jpg,30,È possibile estendere il prestito per altri 30 giorni.
Robert Louis Stevenson,La freccia nera,"La freccia nera / a cura di Edi Vesco ; liberamente ispirato alla serie TV in onda su Canale 5 Pubblicazione Milano : Sperling & Kupfer, 2006 269 p., [8! c. di tav. : ill. ; 22 cm. Collezione · Sperling serial",5,Sperling & Kupfer,269,8873391257,avventura,/copertina libri/LaFrecciaNera.jpg,30,È possibile estendere il prestito per altri 30 giorni.
Joseph Conrad,Lord Jim,"One of Joseph Conrad’s greatest novels, Lord Jim brilliantly combines adventure and analysis. Haunted by the memory of a moment of lost nerve during a disastrous voyage, Jim submits to condemnation by a Court of Inquiry. In the wake of his disgrace he travels to the exotic region of Patusan, and as the agent at this remote trading post comes to be revered as ‘Tuan Jim.’ Here he finds a measure of serenity and respect within himself. However, when a gang of thieves arrives on the island, the memory of his earlier disgrace comes again to the fore, and his relationship with the people of the island is jeopardized. This new Broadview edition is based on the first British edition of 1900, which provides the historical basis for the accompanying critical and contextual discussions. The appendices include a wide variety of Conrad’s source material, documents concerning the scandal of the Jeddah, along with other materials such as a substantial selection of early critical comments.",5,Broadview Press,455,1551111721,avventura,/copertina libri/LordJim.jpg,30,È possibile estendere il prestito per altri 30 giorni.
