authors,title,description,copies,publisher,pages,isbn10,kind,image,durataprestito,condizioniestensione
Patrick O'Brian,Costa sottovento,"Per Jack Aubrey, capitano di fregata della Royal Navy nei primissimi anni dell'Ottocento, al tempo in cui l'Europa è travolta dal turbine di Napoleone, la vera dimensione della vita è sul mare, tra rande, scotte, fiocchi, controvelacci e controvelaccini. Lo sa bene anche il suo amico Stephen Maturin, medico di bordo, un autentico dottor sottile, marinaio per caso e suo malgrado, che ha condiviso con lui ogni avventura. I due, ora che Aubrey è privo di un comando, affittano una residenza nella campagna inglese, dove vivono come tranquilli gentiluomini, tra una caccia alla volpe e una serata musicale. La vita sulla terraferma presenta però insidie assai più temibili di quelle che si possono incontrare sulle navi, specie quando si materializzano nelle attraenti forme di due deliziose fanciulle che fanno breccia nel loro cuore e, nel contempo, creano qualche malinteso nei loro rapporti. Poiché i guai non arrivano mai soli, un grave problema di debiti (mentre Aubrey pensa di essere in credito con la fortuna) costringe i due a una fuga rocambolesca, davvero sotto mentite spoglie. Ma il mare reclama i suoi diritti, e Jack, sventato persino un possibile ammutinamento, si coprirà di gloria contro i francesi e gli spagnoli, prima a bordo della Polychrest (una strana corvetta che sembra stare a galla per scommessa e affonderà senza troppi rimpianti da parte di nessuno) e poi, ottenuta la tanto sospirata promozione, della Lively, una vera e propria signora degli oceani... Dopo il successo di Primo comando, Patrick O'Brian si conferma in questo libro autore di straordinario interesse, non solo per la consueta, minuziosa attenzione ai particolari storici, per la resa tecnicamente ineccepibile degli scontri navali, ma soprattutto per la capacità di ricostruire l'ambiente della marina nell'epoca gloriosa dei velieri, per le intense descrizioni di paesaggio e per l'abilità - sorretta da un umorismo sempre puntuale e garbato, che più inglese di così non si potrebbe - con cui sa restituire la complessa e delicata tessitura psicologica dei personaggi, in particolare quelli femminili.",5,Longanesi,475,8830430102,avventura,/copertina libri/CostaSottovento.jpg,30,È possibile estendere il prestito per altri 30 giorni.
Giorgio Parra,Manuale di ancoraggio,"Un buon ancoraggio è di fondamentale importanza per dormire sonni tranquilli. Una cosa è svegliarsi di notte per un colpo di vento, controllare che tutto sia in ordine e che l'ancora non ari; altra cosa è svegliarsi per lo stesso colpo di vento e dover intervenire per rimediare a una situazione sempre più precaria perché l'ancora non tiene e la barca si sta pericolosamente avvicinando agli scogli. Quando ci si ancora, specialmente se abbiamo intenzione di passare la notte in baia con la barca affidata a quell'ancoraggio, è buona norma prepararsi sempre alla situazione peggiore, come se la notte successiva portasse con sé la burrasca più violenta. Il volume, introdotto da una parte storica, illustra e commenta le varie tecniche e situazioni relative all'ancoraggio e all'ormeggio, e lo fa con un linguaggio accessibile e un ampio ricorso a fotografie, tabelle e grafici. Chiudono il testo un'interessante appendice scientifica sulle forze che si scaricano sugli ancoraggi e un glossario con tutti i termini specifici.",5,HOEPLI EDITORE,169,8820357534,avventura,/copertina libri/ManualeDiAncoraggio.jpg,30,È possibile estendere il prestito per altri 30 giorni.
Clive Cussler,Alta marea,"Per Dirk Pitt, semplicemente, una vita senza avventura non è degna di essere vissuta. Questa volta l’avventura si chiama Qin Shang, un abietto cinese privo di scrupoli e avido di ricchezze che ha fondato il proprio impero sul contrabbando di droga, di armi e soprattutto di vite umane, la sua merce di scambio preferita, al centro di loschi traffici d’immigrazione illegale. E adesso Qin Shang è disposto a qualsiasi cosa pur d’impadronirsi del relitto di una misteriosa nave carica di capolavori dell’antica arte cinese razziati da Chiang Kaishek durante la sua fuga dalla Cina e comprendente i resti preziosissimi del cosiddetto Uomo di Pechino. La formidabile squadra della NUMA, comandata da Dirk Pitt, non ha però alcuna intenzione di stare a guardare. Seguendo le tracce delle criminose attività della sua preda, Pitt scopre che Qin Shang ha costruito un’enorme installazione portuale in una zona lontana dalle comuni rotte commerciali. Perché ha scelto un luogo così improbabile? Che cosa si nasconde dietro quell’impresa? Mentre si prepara la drammatica resa dei conti finale, una sola cosa è sicura: Pitt ha di fronte il più pericoloso nemico che abbia mai incontrato... Ed è altrettanto certo che Clive Cussler, da narratore di razza qual è, ha fatto centro ancora una volta. Coinvolgente, trascinante, pieno di intrighi, ricco di suspense: Alta marea non è soltanto un concentrato di emozioni e colpi di scena, ma molto di più.",5,Longanesi,582,8830441392,avventura,/copertina libri/AltaMarea.jpg,30,È possibile estendere il prestito per altri 30 giorni.
Clive Cussler,Iceberg (Dirk Pitt 2),El hallazgo de un yate en un iceberg provoca una batalla entre el gobierno norteamericano y una organizacións secreta.,5,DEBOLS!LLO,368,8490621861,avventura,/copertina libri/Iceberg.jpg,30,È possibile estendere il prestito per altri 30 giorni.
Alex Shearer,Sea Legs,"From the acclaimed author of ""The Great Blue Yonder"" comes a funny adventure at sea, complete with all kinds of seafaring shenanigans from mistaken identities to incorrigible twin brothers who plan to stow away on their father's three-week cruise.",5,Simon and Schuster,309,689871430,avventura,/copertina libri/SeaLegs.jpg,30,È possibile estendere il prestito per altri 30 giorni.
"Clive Cussler,Robin Burcell",Pirate,"Unstoppable husband and wife team Sam and Remi Fargo face off against an obsessive millionaire hunting for a lost treasure in this adventure in the #1 New York Times-bestselling series When husband and wife treasure hunters Sam and Remi Fargo try something new, a relaxing vacation, a detour to visit a rare bookstore leads to the discovery of a dead body. All signs point to a book in the store that may contain a secret map, an actual, ink-on-paper guide to a historic fortune. The Fargos take up the challenge and find themselves flying from California to Arizona, from Jamaica to England. Racing against a vicious corporate raider with an unhealthy obsession for this particular treasure, Sam and Remi are slowed by a new betrayal at every turn. It can only mean one thing: someone on their team cannot be trusted. Buzzing with the chemistry and wit of Sam and Remi Fargo, Pirate reinvents the classic treasure hunt as only a Clive Cussler adventure can.",5,Penguin,400,399183995,avventura,/copertina libri/Pirate.jpg,30,È possibile estendere il prestito per altri 30 giorni.
Emilio Salgari,Il Corsaro Nero,"A cura di Sergio CampaillaEdizione integrale«Uomini del mare! Uditemi! Io giuro su Dio, su queste onde che ci sono fedeli compagne e sulla mia anima, che non avrò bene sulla terra finché non avrò vendicato i miei fratelli uccisi da Wan Guld! Che le folgori incendino la mia nave; che le onde mi inghiottano assieme a voi; che i due corsari che dormono sotto queste acque, negli abissi del Gran Golfo, mi maledicano; che la mia anima sia dannata in eterno, se io non ucciderò Wan Guld e sterminerò la sua famiglia come egli ha distrutto la mia!». Con questo tremendo giuramento il conte di Ventimiglia, divenuto il Corsaro Nero, uno dei personaggi più suggestivi creati dalla fantasia di Salgari, promette di vendicare la propria famiglia annientata da un crudele nemico. Ma il destino vorrà che la fanciulla amata dal Corsaro Nero...«Una voce robusta, che aveva una specie di vibrazione metallica, s’alzò dal mare ed echeggiò fra le tenebre, lanciando queste parole minacciose: – Uomini del canotto! Alt! O vi mando a picco!...» Emilio Salgari(Verona 1862 – Torino 1911) compì l’apprendistato letterario collaborando a diversi giornali, come «La Nuova Arena», presso cui pubblicò anche i suoi primi racconti. Raggiunse un vastissimo successo di pubblico con una lunga serie di romanzi d’avventura ambientati in paesaggi esotici e centrati su eroi come Sandokan e il Corsaro Nero. Ma gli ultimi anni della sua vita furono tragici: le precarie condizioni economiche, la cattiva salute, la perdita progressiva dell’ispirazione narrativa e infine il ricovero della moglie in manicomio ridussero lo scrittore alla disperazione, fino al gesto drammatico con cui pose termine ai suoi giorni. Di Salgari la Newton Compton ha pubblicato Le Tigri di Mompracem, Il Corsaro Nero e Sandokan. I pirati della Malesia, e nella collana “I Mammut” Tutte le avventure di Sandokan.",5,Newton Compton Editori,420,8854138916,avventura,/copertina libri/IlCorsaroNero.jpg,30,È possibile estendere il prestito per altri 30 giorni.
John Drake,Flint and Silver,"A captivating and original prequel to ""Treasure Island"" that will delight fans of Robert Louis Stevenson's classic as well as fans of those ""other"" pirates of the Caribbean.",5,Simon and Schuster,359,1416592755,avventura,/copertina libri/FlintAndSilver.jpg,30,È possibile estendere il prestito per altri 30 giorni.
Poul Anderson,Brain Wave,"From the multiple Hugo and Nebula Award–winning author: “A panoramic story of what happens to a world gone super intelligent” (Astounding Science Fiction). With “wonderfully logical detail . . . exciting storytelling and moving characterization” (Anthony Boucher), science fiction master Poul Anderson explores what happens when the next stage of evolution is thrust upon humanity and animals. As Earth passes out of a magnetic field that has suppressed intelligence for eons, the mental capacity for all mammals increases exponentially, radically changing the structures of society. A mentally impaired farm worker finds himself capable of more delicate and intelligent thoughts than he ever dreamed. A young boy on holiday manages to discern the foundations of calculus before breakfast. Animals that were seen as livestock and pets can now communicate clearly with their owners and one another. And an already brilliant physics researcher now uses his boundless intellect to bring humankind to the stars—even as his wife plunges into an existential crisis. For all of them, the world will never be the same . . .",5,Open Road Media,212,1504053672,fantascienza,/copertina libri/BrainWave.jpg,30,È possibile estendere il prestito per altri 30 giorni.
Aldous Huxley,Brave New World,"Huxley's bleak future prophesized in Brave New World was a capitalist civilization which had been reconstituted through scientific and psychological engineering, a world in which people are genetically designed to be passive and useful to the ruling class. Satirical and disturbing, Brave New World is set some 600 years ahead, in ""this year of stability, A.F. 632""--the A.F. standing for After Ford, meaning the godlike Henry Ford. ""Community, Identity, Stability,"" is the motto. Reproduction is controlled through genetic engineering, and people are bred into a rigid class system. As they mature, they are conditioned to be happy with the roles that society has created for them. The rest of their lives are devoted to the pursuit of pleasure through sex, recreational sports, the getting and having of material possessions, and taking a drug called Soma. Concepts such as family, freedom, love, and culture are considered grotesque. Against this backdrop, a young man known as John the Savage is brought to London from the remote desert of New Mexico. What he sees in the new civilization a ""brave new world"" (quoting Shakespeare's The Tempest). However, ultimately, John challenges the basic premise of this society in an act that threatens and fascinates its citizens. Huxley uses his entire prowess to throw the idea of utopia into reverse, presenting us what is known as the ""dystopian"" novel. When Brave New World was written (1931), neither Hitler nor Stalin had risen to power. Huxley saw the enduring threat to society from the dark side of scientific and social progress, and mankind's increasing appetite for simple amusement. Brave New World is a work that indicts the idea of progress for progress sake and is backed up with force and reason.",5,RosettaBooks,288,795311257,fantascienza,/copertina libri/BraveNewWorld.jpg,30,È possibile estendere il prestito per altri 30 giorni.
Clifford D. Simak,City (Urania),"In City (già pubblicato su ""Urania"" con il titolo Anni senza fine) assistiamo al lento declino della specie umana, simboleggiata dalla famiglia Webster per innumerevoli generazioni, dall'anno 2000 al 20000. All'abbandono da parte dell'uomo delle città, divenute ormai un relitto di epoche preistoriche. All'inizio della civiltà canina prefigurata da Nathaniel, il primo Cane parlante, che insieme all'altro grande amico dell'uomo, il robot, prepara il mondo di un lontano futuro, quando l'uomo sarà scomparso dalla Terra. Ci sono le pagine grandiose del tentativo di colonizzare Giove, popolato da una razza indescrivibile nella quale l'umanità della Terra si annullerà, e poi la cupa e incomprensibile civiltà delle formiche, volte in silenzio alla conquista del pianeta. Allora i nostri ultimi discendenti si nasconderanno in un mondo spettrale che solo i Cani presentono... Un romanzo epico e visionario, degno erede dei classici di Olaf Stapledon e H.G. Wells.",5,Edizioni Mondadori,280,8852070710,fantascienza,/copertina libri/City.jpg,30,È possibile estendere il prestito per altri 30 giorni.
Italo Calvino,Cosmicomics,Twelve stories by the brilliant Italian author employ the history of science and the poetic imagination to ring changes on the theme and activity of creation,5,Houghton Mifflin Harcourt,153,156226006,fantascienza,/copertina libri/Cosmicomics.jpg,30,È possibile estendere il prestito per altri 30 giorni.
Hayford Peirce,Dinosaur Park,"""Dinosaur Park"" is a loving homage to the works of Jack Vance. Thousands of years from now, the human race has expanded throughout the galaxy, colonizing millions of worlds and creating myriads of bizarre new religious cults and sects. One of these worlds is Stohlson's Redemption, where the human settlers raise dinosaurs for their religious ceremonies. When the ten-year-old Kerryl Ryson creates an unseemly incident that upsets a visiting Important Person, his father is fed to a dinosaur -- as an object lesson in politeness -- and his remaining family are sold into slavery. For sixteen years Kerryl has plotted his revenge. Now, with the aid of a beautiful noblewoman, a time machine, a race of aliens who use the Mesozoic Era of Earth as a setting for adventure videos, and a stampede of ravaging dinosaurs, Kerryl gets his chance to even the interstellar score. But first he has to escape from several death sentences. . . . In fact, he must come back from the dead! ""Space opera took a unique form in the hands of Jack Vance, as he transformed two-fisted swash-buckling to an artistry of pungent, subtle ironies. . . . [Dinosaur Park] is a very faithful effort, chock-a-block with poignant nomenclature, strange lands, and dinosaurs (cf The Dragon Masters), and featuring the requisite grim young hero out for revenge. "" --Locus ""This book is a screamingly funny sendup of Jack Vance's writing style by the author of ' Napoleon Disentimed' and the Chap Foey Rider stories in Analog magazine. If you are a Vance fan, do not miss it!"" -- Raymond's Reviews ""Of all the writers I discovered during my years as an editor, Hayford Peirce is the most original stylist and undoubtedly the one with the wickedest sense of humor."" -- Ben Bova ""Hayford Peirce is debonair, witty, and a keen student of the cosmopolis: all of which is reflected in his writing. He also displays a knack for seizing and holding a reader's attention: certainly he is among the most entertaining of all science-fiction writers."" -- Jack Vance",5,Wildside Press LLC,258,1434412490,fantascienza,/copertina libri/DinosaurPark.jpg,30,È possibile estendere il prestito per altri 30 giorni.
Philip K. Dick,Do Androids Dream of Electric Sheep?,"A masterpiece ahead of its time, a prescient rendering of a dark future, and the inspiration for the blockbuster film Blade Runner--now in a sharp new edition with an introduction by New York Times bestselling author Jason M. Hough By 2021, the World War has killed millions, driving entire species into extinction and sending mankind off-planet. Those who remain covet any living creature, and for people who can't afford one, companies built incredibly realistic simulacra: horses, birds, cats, sheep. They've even built humans. Immigrants to Mars receive androids so sophisticated they are indistinguishable from true men or women. Fearful of the havoc these artificial humans can wreak, the government bans them from Earth. Driven into hiding, unauthorized androids live among human beings, undetected. Rick Deckard, an officially sanctioned bounty hunter, is commissioned to find rogue androids and ""retire"" them. But when cornered, androids fight back--with lethal force. Praise for Philip K. Dick ""The most consistently brilliant science fiction writer in the world.""--John Brunner ""A kind of pulp-fiction Kafka, a prophet.""--The New York Times ""[Philip K. Dick] sees all the sparkling--and terrifying--possibilities . . . that other authors shy away from.""--Rolling Stone",5,Random House Publishing Group,240,345404475,fantascienza,/copertina libri/DoAndroidsDreamOfElectricSheep.jpg,30,È possibile estendere il prestito per altri 30 giorni.
Gordon R. Dickson,Dorsai!,"On the planet Arcadia, a young man and woman and a swamp otter join together to haul the otter's eleven hundred pound statue overland to meet the deadline of a prospective buyer from another planet.",5,Simon and Schuster,115,1627934839,fantascienza,/copertina libri/Dorsai.jpg,30,È possibile estendere il prestito per altri 30 giorni.
Frank Herbert,Dune,"A deluxe hardcover edition of the best-selling science-fiction book of all time--part of Penguin Galaxy, a collectible series of six sci-fi/fantasy classics, featuring a series introduction by Neil Gaiman Science fiction's supreme masterpiece, Dune will be forever considered a triumph of the imagination. Set on the desert planet Arrakis, it is the story of the boy Paul Atreides, who will become the mysterious man known as Muad'Dib. Paul's noble family is named stewards of Arrakis, whose sands are the only source of a powerful drug called ""the spice."" After his family is brought down in a traitorous plot, Paul must go undercover to seek revenge, and to bring to fruition humankind's most ancient and unattainable dream. A stunning blend of adventure and mysticism, environmentalism and politics, Dune won the first Nebula Award, shared the Hugo Award, and formed the basis of what is undoubtedly the grandest epic in science fiction. Penguin Galaxy Six of our greatest masterworks of science fiction and fantasy, in dazzling collector-worthy hardcover editions, and featuring a series introduction by #1 New York Times bestselling author Neil Gaiman, Penguin Galaxy represents a constellation of achievement in visionary fiction, lighting the way toward our knowledge of the universe, and of ourselves. From historical legends to mythic futures, monuments of world-building to mind-bending dystopias, these touchstones of human invention and storytelling ingenuity have transported millions of readers to distant realms, and will continue for generations to chart the frontiers of the imagination. The Once and Future King by T. H. White Stranger in a Strange Land by Robert A. Heinlein Dune by Frank Herbert 2001: A Space Odyssey by Arthur C. Clarke The Left Hand of Darkness by Ursula K. Le Guin Neuromancer by William Gibson For more than seventy years, Penguin has been the leading publisher of classic literature in the English-speaking world. With more than 1,700 titles, Penguin Classics represents a global bookshelf of the best works throughout history and across genres and disciplines. Readers trust the series to provide authoritative texts enhanced by introductions and notes by distinguished scholars and contemporary authors, as well as up-to-date translations by award-winning translators.",5,Penguin,720,143111582,fantascienza,/copertina libri/Dune.jpg,30,È possibile estendere il prestito per altri 30 giorni.
Orson Scott Card,Ender's Game,"This engaging, collectible, miniature hardcover of the Orson Scott Card classic and worldwide bestselling novel, Ender's Game, makes an excellent gift for anyone's science fiction library. “Ender's Game is an affecting novel.""—New York Times Book Review Once again, Earth is under attack. An alien species is poised for a final assault. The survival of humanity depends on a military genius who can defeat the aliens. But who? Ender Wiggin. Brilliant. Ruthless. Cunning. A tactical and strategic master. And a child. Recruited for military training by the world government, Ender's childhood ends the moment he enters his new home: Battle School. Among the elite recruits Ender proves himself to be a genius among geniuses. He excels in simulated war games. But is the pressure and loneliness taking its toll on Ender? Simulations are one thing. How will Ender perform in real combat conditions? After all, Battle School is just a game. Isn't it?",5,Tor Books,448,765394863,fantascienza,/copertina libri/EndersGame.jpg,30,È possibile estendere il prestito per altri 30 giorni.
Isaac Asimov,Foundation,"For twelve thousand years the Galactic Empire has ruled supreme. Now it is dying. But only Hari Sheldon, creator of the revolutionary science of psychohistory, can see into the future--to a dark age of ignorance, barbarism, and warfare that will last thirty thousand years. To preserve knowledge and save mankind, Seldon gathers the best minds in the Empire--both scientists and scholars--and brings them to a bleak planet at the edge of the Galaxy to serve as a beacon of hope for a fututre generations. He calls his sanctuary the Foundation. But soon the fledgling Foundation finds itself at the mercy of corrupt warlords rising in the wake of the receding Empire. Mankind's last best hope is faced with an agonizing choice: submit to the barbarians and be overrun--or fight them and be destroyed.",5,Spectra,320,553900345,fantascienza,/copertina libri/Foundation.jpg,30,È possibile estendere il prestito per altri 30 giorni.
George Orwell,“1984”,"George Orwell’s 1984 takes on new life with extraordinary relevance and renewed popularity. “Orwell saw, to his credit, that the act of falsifying reality is only secondarily a way of changing perceptions. It is, above all, a way of asserting power.”—The New Yorker In 1984, London is a grim city in the totalitarian state of Oceania where Big Brother is always watching you and the Thought Police can practically read your mind. Winston Smith is a man in grave danger for the simple reason that his memory still functions. Drawn into a forbidden love affair, Winston finds the courage to join a secret revolutionary organization called The Brotherhood, dedicated to the destruction of the Party. Together with his beloved Julia, he hazards his life in a deadly match against the powers that be. Lionel Trilling said of Orwell’s masterpiece, “1984 is a profound, terrifying, and wholly fascinating book. It is a fantasy of the political future, and like any such fantasy, serves its author as a magnifying device for an examination of the present.” Though the year 1984 now exists in the past, Orwell’s novel remains an urgent call for the individual willing to speak truth to power.",5,Houghton Mifflin Harcourt,648,5472496430,fantascienza,/copertina libri/1984.jpg,30,È possibile estendere il prestito per altri 30 giorni.
Ray Bradbury,Fahrenheit 451,"For use in schools and libraries only. A totalitarian regime has ordered all books to be destroyed, but one of the book burners suddenly realizes their merit.",5,Simon & Schuster,192,6718742295,fantascienza,/copertina libri/Fahrenheit451.jpg,30,È possibile estendere il prestito per altri 30 giorni.
James G. Ballard,Il condominio,"Il condominio futuristico che ci descrive Ballard nel suo romanzo, è una città verticale di quaranta piani con duemila abitanti chiusi dentro una scatola di cemento dalla terra al cielo, posto in una zona residenziale di Londra. Tutti i condomini sono proprietari dello stabile gestito da un amministratore abitante nel grattacielo insieme ad alcuni dipendenti. All'interno tutti i confort, il decimo piano grande come una portaerei contiene una serie di servizi come una banca, un supermarket, una palestra, uno spaccio di alcolici, una piscina e una scuola materna per i pochi bimbi del condominio, salendo più in alto al trentacinquesimo piano ci sono altri servizi di lusso: una seconda piscina, una sauna e un ristorante. Ma questo condominio è diviso anche in tre classici ceti sociali: alto, medio e basso che saranno decisivi ai fini del romanzo, portando i loro inquilini in una sorta di imbarbarimento.",5,Feltrinelli,192,8807817551,fantascienza,/copertina libri/IlCondominio.jpg,30,È possibile estendere il prestito per altri 30 giorni.
