authors,title,description,copies,publisher,pages,isbn10,kind,image,durataprestito,condizioniestensione
Matthew Lewis,The Monk,"'He was deaf to the murmurs of conscience, and resolved to satisfy his desires at any price.' The Monk (1796) is a sensational story of temptation and depravity, a masterpiece of Gothic fiction and the first horror novel in English literature. The respected monk Ambrosio, the Abbot of a Capuchin monastery in Madrid, is overwhelmed with desire for a young girl; once having abandoned his monastic vows he begins a terrible descent into immorality and violence. His appalling fall from grace embraces blasphemy, black magic, torture, rape, and murder, and places his very soul in jeopardy. Lewis's extraordinary tale drew on folklore, legendary ghost stories, and contemporary dread inspired by the terrors of the French Revolution. Its excesses shocked the reading public and it was condemned as obscene. The novel continues to beguile and shock readers today with its gruesome catalogue of iniquities, while at the same time giving a profound insight into the deep anxieties experienced by British citizens during one of the most turbulent periods in the nation's history. ABOUT THE SERIES: For over 100 years Oxford World's Classics has made available the widest range of literature from around the globe. Each affordable volume reflects Oxford's commitment to scholarship, providing the most accurate text plus a wealth of other valuable features, including expert introductions by leading authorities, helpful notes to clarify the text, up-to-date bibliographies for further study, and much more.",5,Oxford University Press,416,1987044535,horror,/copertina libri/TheMonk.jpg,30,È possibile estendere il prestito per altri 30 giorni.
Bram Stoker,Dracula,"The classic horror tale of the powerful, centuries-old vampire follows his bloodthirsty trail from the mountains of Central Europe to England, until Dr. Van Helsing comes up with a way to end his reign of terror.",5,Ignatius Press,558,1586174940,horror,/copertina libri/Dracula.jpg,30,È possibile estendere il prestito per altri 30 giorni.
Anne Rice,Interview with the Vampire,"Recounting his first two hundred years of life, a vampire tells of his erotic alliance with Claudia, whose passions are forever locked up in the body of a child",5,"Random House Digital, Inc.",346,345337662,horror,/copertina libri/InterviewWithTheVampire.jpg,30,È possibile estendere il prestito per altri 30 giorni.
Stephen King,The Stand,"Stephen King’s apocalyptic vision of a world blasted by plague and tangled in an elemental struggle between good and evil remains as riveting and eerily plausible as when it was first published. A patient escapes from a biological testing facility, unknowingly carrying a deadly weapon: a mutated strain of super-flu that will wipe out 99 percent of the world’s population within a few weeks. Those who remain are scared, bewildered, and in need of a leader. Two emerge—Mother Abagail, the benevolent 108-year-old woman who urges them to build a peaceful community in Boulder, Colorado; and Randall Flagg, the nefarious “Dark Man,” who delights in chaos and violence. As the dark man and the peaceful woman gather power, the survivors will have to choose between them—and ultimately decide the fate of all humanity. (This edition includes all of the new and restored material first published in The Stand: The Complete And Uncut Edition.) From the Trade Paperback edition.",5,Anchor,1200,3855288755,horror,/copertina libri/TheStand.jpg,30,È possibile estendere il prestito per altri 30 giorni.
Stephen King,Carrie,"In this classic tale of psychic power and human cruelty, a tormented teenage girl reigns terrible vengence down on her enemies at the prom. Reprint.",5,Simon and Schuster,208,671039733,horror,/copertina libri/Carrie.jpg,30,È possibile estendere il prestito per altri 30 giorni.
Stephen King,The Shining,"With an excerpt from the sequel, Doctor Sleep. Terrible events occur at an isolated hotel in the off season, when a small boy with psychic powers struggles to hold his own against the forces of evil that are driving his father insane.",5,Anchor,464,385528868,horror,/copertina libri/TheShining.jpg,30,È possibile estendere il prestito per altri 30 giorni.
Robert R. McCammon,Boy's Life,"An Alabama boy’s innocence is shaken by murder and madness in the 1960s South in this novel by the New York Times–bestselling author of Swan Song. It’s 1964 in idyllic Zephyr, Alabama. People either work for the paper mill up the Tecumseh River, or for the local dairy. It’s a simple life, but it stirs the impressionable imagination of twelve-year-old aspiring writer Cory Mackenson. He’s certain he’s sensed spirits whispering in the churchyard. He’s heard of the weird bootleggers who lurk in the dark outside of town. He’s seen a flood leave Main Street crawling with snakes. Cory thrills to all of it as only a young boy can. Then one morning, while accompanying his father on his milk route, he sees a car careen off the road and slowly sink into fathomless Saxon’s Lake. His father dives into the icy water to rescue the driver, and finds a beaten corpse, naked and handcuffed to the steering wheel—a copper wire tightened around the stranger’s neck. In time, the townsfolk seem to forget all about the unsolved murder. But Cory and his father can’t. Their search for the truth is a journey into a world where innocence and evil collide. What lies before them is the stuff of fear and awe, magic and madness, fantasy and reality. As Cory wades into the deep end of Zephyr and all its mysteries, he’ll discover that while the pleasures of childish things fade away, growing up can be a strange and beautiful ride. “Strongly echoing the childhood-elegies of King and Bradbury, and every bit their equal,” Boy’s Life, a winner of both the Bram Stoker and World Fantasy Awards, represents a brilliant blend of mystery and rich atmosphere, the finest work of one of today’s most accomplished writers (Kirkus Reviews).",5,Open Road Media,582,1453231560,horror,/copertina libri/boysLife.jpg,30,È possibile estendere il prestito per altri 30 giorni.
Robert R. McCammon,Mine,"A psychopathic female fugitive provokes a mother’s vengeance in this terrifying thriller by the New York Times–bestselling author of Gone South and Boy’s Life. Back in the 1960s, Mary Terrell shot and killed a man. A former member of the fanatical Storm Front Brigade—a splinter group of the notorious Weathermen—Terrell has stayed one step ahead of the FBI for decades. Living with numerous identities and menial jobs, Terrell’s only constants in life have been LSD, psychotic delusions of motherhood, and murderous rage. The sixties are long gone, but Mary is still out there. Now, provoked by a message she reads in Rolling Stone, she’s convinced that the surviving leader of her old band of radicals wants to build a life with her. So one night, Mary sneaks into the maternity ward of an Atlanta hospital. Laura Clayborne has a successful career and now, a newborn baby. She’s the type of person who is sensitive to suffering and injustice. But the kidnapping of her infant son has brought out a white-hot fury. She’s not going to sit and wait while the FBI investigates. She’s going after Mary herself—headlong and relentless—on a twisting and violent cross-country pursuit to get her child back. But to track a madwoman, Laura will have to think like one . . . A Bram Stoker Award winner, this “expertly constructed novel of suspense and horror” (Publishers Weekly) from the author of Swan Song, Speaks the Nightbird, and other acclaimed works is “feverishly exciting . . . a page-whipping thriller” (Kirkus Reviews).",5,Open Road Media,490,1453231552,horror,/copertina libri/Mine.jpg,30,È possibile estendere il prestito per altri 30 giorni.
Robert R. McCammon,Bethany's Sin,"A family moves to a small town dominated by a murderous cult Despite its eerie name, Bethany’s Sin is a pleasant place. After a life of grim poverty, this new community seems like heaven to Evan Reid and his family. With its quaint shops, manicured lawns, and fresh summer smell, the town charms the Vietnam veteran, his wife, and their daughter like nowhere else they have ever been. But beneath that cheerful façade lurks something deadly. As soon as they enter their new house, Evan is consumed by fear. He can’t place its source, but there is something about the town’s mayor, Kathryn Drago, which makes him uneasy. By day she is a harmless retired archaeologist. But at night she leads an Amazonian cult whose next ritual calls for a secret ingredient: the blood of Evan Reid.",5,Open Road Media,350,1453231471,horror,/copertina libri/Bethany'sSin.jpg,30,È possibile estendere il prestito per altri 30 giorni.
Dean Koontz,The Face of Fear,"A brutal killer known as ?The Butcher” is stalking women in New York City. When the police enlist the help of clairvoyant Graham Harris, the horrifying images of the Butcher's crimes replay in Harris's mind?sometimes even at the moment they are happening. Then he sees the most terrifying vision of all?that of his own murder. Harris and his girlfriend soon find themselves trapped on the fortieth floor of a deserted office building. The guards have been murdered, the elevators shut down, and the stairways blocked. The only way out is to climb down the sheer face of the building. But there is a blizzard outside with fifty-mile-an-hour winds?and a dangerous fall from Mount Everest has left Harris paralyzed with fear. He must risk the climb?or become the Butcher's next victim. With a new afterword by the author",5,Penguin,341,425250755,horror,/copertina libri/TheFaceOfFear.jpg,30,È possibile estendere il prestito per altri 30 giorni.
Seth Grahame-Smith,The Last American Vampire,"Vampire Henry Sturges returns in the highly anticipated sequel to Abraham Lincoln: Vampire Hunter-a sweeping, alternate history of twentieth-century America by New York Times bestselling author Seth Grahame-Smith. THE LAST AMERICAN VAMPIRE In Reconstruction-era America, vampire Henry Sturges is searching for renewed purpose in the wake of his friend Abraham Lincoln's shocking death. Henry's will be an expansive journey that first sends him to England for an unexpected encounter with Jack the Ripper, then to New York City for the birth of a new American century, the dawn of the electric era of Tesla and Edison, and the blazing disaster of the 1937 Hindenburg crash. Along the way, Henry goes on the road in a Kerouac-influenced trip as Seth Grahame-Smith ingeniously weaves vampire history through Russia's October Revolution, the First and Second World Wars, and the JFK assassination. Expansive in scope and serious in execution, THE LAST AMERICAN VAMPIRE is sure to appeal to the passionate readers who made Abraham Lincoln: Vampire Hunter a runaway success.",5,Grand Central Publishing,320,1455502103,horror,/copertina libri/TheLastAmericanVampire.jpg,30,È possibile estendere il prestito per altri 30 giorni.
Regina Jeffers,Vampire Darcy's Desire,"A twist on the classic Austen tale profiles Darcy as a half-vampire who flees to Netherfield to escape the intense pressure on him to marry and struggles with his love for Elizabeth out of a strong need to protect her from his vampire life, a situation that is complicated by the machinations of a demonic George Wickham. Original. 25,000 first printing.",5,Ulysses Press,446,1569757313,horror,/copertina libri/Vampire Darcy's Desire.jpg,30,È possibile estendere il prestito per altri 30 giorni.
Tananarive Due,The Living Blood,"From the author of the national bestseller My Soul to Keep comes a riveting new novel of supernatural suspense -- a gripping tale that brilliantly showcases a writer at the pinnacle of her astounding storytelling abilities. Jessica Jacobs-Wolde has somehow survived the worst that any mother or wife could ever endure: the deaths of her husband and first daughter. But now, four years later, not only is the nightmare continuing -- it may have only just begun. Jessica has discovered the terrifying truth behind the legacy that her husband left to their second daughter, Fana...a legacy preordained a thousand years before her time and drenched in the powerful lifeblood that now courses through her veins. As young Fana begins to display unearthly abilities that are quickly spiraling out of control, she becomes the target of those who will stop at nothing to exploit her power -- and the unwitting touchstone in an ancient supernatural battle whose outcome may decide the fate of all humanity.",5,Simon and Schuster,528,1439121923,horror,/copertina libri/TheLivingBlood.jpg,30,È possibile estendere il prestito per altri 30 giorni.
Frank De Felitta,Audrey Rose,"When Elliot Hoover loses his wife and daughter, Audrey Rose, in a fiery car crash, his world explodes. To heal his mental anguish and claim some peace, he visits a psychic who reveals to him that his daughter has been reincarnated into Ivy Templeton, a young girl living in New York City. Desperate to reclaim anything from his daughter's past, he searches out Ivy, only to discover that the unbelievable is shockingly true-his daughter is back. Now, in an effort to save her life, Hoover must choose between two horrifying possibilities-leaving his daughter's soul in torment, or taking the life of the young girl in whom she now lives.",5,Grand Central Publishing,480,446556327,horror,/copertina libri/AudreyRose.jpg,30,È possibile estendere il prestito per altri 30 giorni.
Susan Cooper,The Dark Is Rising,"The perfect book for the Christmas season. It is Midwinter's Eve, the night before Will's eleventh birthday. But there is an atmosphere of fear in the familiar countryside around him. Will is about to make a shocking discovery - that he is the last person to be born with the power of the Old Ones, and as a guardian of the Light he must begin a dangerous journey to vanquish the terrifyingly evil magic of the Dark.",5,Random House,400,1409048349,horror,/copertina libri/TheDarkIsRising.jpg,30,È possibile estendere il prestito per altri 30 giorni.
Susan Cooper,The Grey King,"A strange boy and dog remind Will Stanton that he is an immortal, whose quest is to find the golden harp which will rouse others from a long slumber in the Welsh hills so they may prepare for the ultimate battle of Light versus Dark.",5,Simon and Schuster,192,1416949674,horror,/copertina libri/TheGrayKing.jpg,30,È possibile estendere il prestito per altri 30 giorni.
Neil Gaiman,American Gods,"American Gods by Neil Gaiman, the epic road trip novel from the Sunday Times bestselling author of Norse Mythology, is an imaginative masterpiece and now the hottest TV series of 2017 starring Ricky Whittle, IanMcShane and Gillian Anderson and broadcast on Amazon Prime Video in the UK. 'Gaiman is a treasure-house of story and we are lucky to have him' Stephen King. After three years in prison, Shadow has served his time. But as the days and hours until his release tick away, he can feel a storm brewing. Two days before his release date, his wife Laura dies in a mysterious car crash, in adulterous circumstances. Dazed, Shadow travels home, only to encounter the bizarre Mr Wednesday, who claims to be a refugee from a distant war, a former god and the king of America. Together they embark on a very strange journey across the States, along the way solving the murders which have occurred every winter in one small American town. But the storm is about to break . . . Disturbing, gripping and profoundly strange, Gaiman's epic novel sees him on the road to the heart of America.",5,Hachette UK,521,755379926,horror,/copertina libri/americanGods.jpg,30,È possibile estendere il prestito per altri 30 giorni.
Neil Gaiman,Anansi Boys,"In this #1 New York Times bestseller, Neil Gaiman returns to the territory of his masterpiece, American Gods (soon to be a Starz Original Series) to once again probe the dark recesses of the soul. God is dead. Meet the kids. Fat Charlie Nancy’s normal life ended the moment his father dropped dead on a Florida karaoke stage. Charlie didn’t know his dad was a god. And he never knew he had a brother. Now brother Spider is on his doorstep—about to make Fat Charlie’s life more interesting . . . and a lot more dangerous. “Thrilling, spooky, and wondrous.” —Denver Post “Awesomely inventive.… When you take the free-fall plunge into a Neil Gaiman book, anything can happen and anything invariably does.” —Entertainment Weekly “Delightful, funny and affecting.... A tall tale to end all tall tales.” —Washington Post Book World",5,Harper Collins,416,61794975,horror,/copertina libri/anansiBoys.jpg,30,È possibile estendere il prestito per altri 30 giorni.
David Morrell,Creepers,"CREEPERS, David Morrell's gripping joyride of a thriller, depicts every harrowing second in eight hours of relentless terror. A New York Times bestseller, it received the prestigious Stoker Award from the Horror Writers Association. On a cold October night, five people gather in a run-down motel on the New Jersey shore and begin preparations to break in to the Paragon Hotel. Built in the glory days of Asbury Park by a reclusive millionaire, the magnificent structure—which foreshadowed the beauties of art-deco architecture—is now boarded up and marked for demolition. The five people are ""creepers,"" the slang term for urban explorers: city archeologists with a passion for investigating abandoned buildings and their dying secrets. On this evening, they are joined by a reporter who wants to profile them—anonymously, as this is a highly illegal activity—for a New York Times article. Frank Balenger isn't looking for just a story, however. And after the group enters the rat-infested tunnel leading to the hotel, it becomes clear that he will get much more than he bargained for. Danger, terror, and death await the creepers in a place ravaged by time and redolent of evil. The darkest secrets live in places you’re not supposed to be. “Chilling.” —Stephen King, New York Times bestselling author of Doctor Sleep “Crack this novel, and it’s like an alien abduction of your brain—forget resuming your normal life until it’s finished. This will be a classic.”—Douglas Preston, New York Times bestselling co-author (with Lincoln Child) of White Fire “With its nonstop cascade of ingeniously contrived dangers and assaults, culminating in an apocalyptic finale, Creepers provides the essence of all thrillers, an intense emotional effect that will leave readers drained.”—Washington Post",5,David Morrell ,513,6155044216,horror,/copertina libri/Creepers.jpg,30,È possibile estendere il prestito per altri 30 giorni.
David Morrell,The Covenant of the Flame,"Reporter Tess Drake discovers a mysterious altar in the apartment of a friend whose charred body was discovered in a nearby park. The meaning of that altar propels Tess on a furious hunt for the truth about what happened to her friend, a labyrinth of intrigue and danger that leads to the highest levels of power as well as to the depths of a secret cave in Spain. Less From the master of high action comes a novel of deception and intrigue that paved the way for the history-based religious thrillers of Dan Brown, Steve Berry, and James Rollins. In 1244, at the infamous fortress of Montségur in southwestern France, Christian Inquisitors massacred the last vestige of a heresy known as Mithraism, once the dominant religion of the Roman Empire. But was the heresy in fact destroyed? In today’s New York City, reporter Tess Drake discovers a mysterious altar in the apartment of a friend whose charred body was discovered in a nearby park. The altar (a version of it exists in the British Museum) depicts a man astride a bull, plunging a knife into its neck while a dog, a scorpion, and a snake drink the blood. The meaning of that altar propels Tess on a furious hunt for the truth about what happened to her friend, a labyrinth of intrigue and danger that leads to the highest levels of power as well as to the depths of a secret cave in Spain. This special e-version of THE COVENANT OF THE FLAME has a revised text and an introduction in which David Morrell describes the unusual personal events that prompted him to write this novel. “A mega-thriller by any standard” —Associated Press “David Morrell is, to me, the finest thriller writer living today, bar none.” —Steve Berry, New York Times bestselling author of The Jefferson Key “A master storyteller” —James Rollins, New York Times bestselling author of The Devil Colony",5,David Morrell ,412,1937760095,horror,/copertina libri/TheCovenantOfTheFlame.jpg,30,È possibile estendere il prestito per altri 30 giorni.
David Morrell,First Blood,"From New York Times bestselling author, David Morrell, comes a classic thriller that introduced the character of Rambo, one of the most iconic action heroes of the twentieth century. Called “the father of the modern action novel,” FIRST BLOOD changed the genre. Although the book and the film adaptation have similarities, they are very different, especially its unexpected ending and its greater intensity. If you’ve only experienced the film, you’re in for a surprise. Once they were soldiers. Rambo, the ragged kid whose presence in town is considered a threat. And Teasle, the Chief of Police of Madison, Kentucky. Both have been trained to kill: Rambo in Vietnam, Teasle in Korea. They learned different military tactics, different ways of death and survival in two different wars. Now, without warning, they are enemies in a civilian combat that becomes a chase through the woods and mountains and caves above the town. As we follow them, we understand that once a man has been trained as a killer, perhaps he is changed forever. Award-winning FIRST BLOOD was published in 1972, was translated into 26 languages, and has never been out of print. It was one of the first novels to deal with post-traumatic stress disorder. David’s novelizations for RAMBO (FIRST BLOOD PART II) and RAMBO III are available as e-books. They’re quite different from the films and include revealing introductions. See also David’s RAMBO AND ME: THE STORY BEHIND THE STORY. Critical reactions: “A fine novel. . . . When Johnny comes marching home this time, watch out.” —The New York Times Sunday Book Review “A first-rate thriller.” —Newsweek “One of the finest chase novels you will ever read.” —Minneapolis Tribune “A terrific thriller.” —Saturday Review “One hell of a hard, fast novel.” —John D. MacDonald",5,David Morrell ,115,1937760022,horror,/copertina libri/FirstBlood.jpg,30,È possibile estendere il prestito per altri 30 giorni.
Charlaine Harris,Dead and Gone,"The ninth installment in the series that inspired the HBO original True Blood offers another exciting undead adventure, which opens with a vampire fashion show, showing just one of the fruits of the author's unique writing style. Original.",5,Penguin,312,4410171506,horror,/copertina libri/DeadAndGone.jpg,30,È possibile estendere il prestito per altri 30 giorni.
Charlaine Harris,Day Shift,"DON'T MISS MIDNIGHT, TEXAS, THE NBC TV SERIES BASED ON CHARLAINE HARRIS'S BESTSELLING NOVELS! The #1 New York Times bestselling author of the Sookie Stackhouse novels returns to the one-stoplight town of Midnight, Texas, a place where no one is quite what they seem... There is no such thing as bad publicity, except in Midnight, where the residents like to keep to themselves. When psychic Manfred Bernardo finds himself embroiled in a scandal and hounded by the press after one of his regular clients dies during a reading, he turns to enigmatic, beautiful, and dangerous Olivia Charity for help. Somehow he knows that the mysterious Olivia can get things back to normal. As normal as things get in Midnight... Includes an excerpt of Night Shift",5,Ace Books,386,4252632078,horror,/copertina libri/DayShift.jpg,30,È possibile estendere il prestito per altri 30 giorni.
Poppy Brite,Lost Souls,"Vampires . . . they ache, they love, they thirst for the forbidden. They are your friends and lovers, and your worst fears. “A major new voice in horror fiction . . . an electric style and no shortage of nerve.”—Booklist At a club in Missing Mile, N.C., the children of the night gather, dressed in black, look for acceptance. Among them are Ghost, who sees what others do not; Ann, longing for love; and Jason, whose real name is Nothing, newly awakened to an ancient, deathless truth about his father, and himself. Others are coming to Missing Mile tonight. Three beautiful, hip vagabonds—Molochai, Twig, and the seductive Zillah, whose eyes are as green as limes—are on their own lost journey, slaking their ancient thirst for blood, looking for supple young flesh. They find it in Nothing and Ann, leading them on a mad, illicit road trip south to New Orleans. Over miles of dark highway, Ghost pursues, his powers guiding him on a journey to reach his destiny, to save Ann from her new companions, to save Nothing from himself. . . . “An important and original work . . . a gritty, highly literate blend of brutality and sentiment, hope and despair.”—Science Fiction Chronicle",5,Dell,384,307768287,horror,/copertina libri/LostSouls.jpg,30,È possibile estendere il prestito per altri 30 giorni.
